{
  "claim_level": "open-question",
  "clinical_use_boundary": [
    "not-medical-advice",
    "not-diagnostic",
    "not-treatment-recommendation",
    "not-trial-recommendation",
    "research-use-only"
  ],
  "copied_reference_routes": [
    {
      "copied_fields": {
        "claim_level": "open-question",
        "date": "2026-04-15",
        "disease_program": "multiple-myeloma",
        "packet_type": "multidisciplinary-review-packet-template",
        "review_packet_builder_manifest_id": "myeloma-review-packet-builder-manifest-template-v0",
        "title": "Multiple Myeloma Review-Packet Builder Manifest Template v0"
      },
      "decision": "copy",
      "manifest_section": "manifest-identity",
      "output_boundary": "Copied manifest identity only; no inference about review completion, publication readiness, or clinical use.",
      "route_id": "route-001-manifest-identity"
    },
    {
      "copied_fields": {
        "artifact_id": "multiple-myeloma-multidisciplinary-review-packet-template-v0",
        "packet_boundary": "Template only; do not fill public packet with real case facts.",
        "path": "disease-programs/multiple-myeloma/reviews/multidisciplinary-review-packet-template-v0.md",
        "review_status": "expert-review-needed"
      },
      "decision": "reference",
      "manifest_section": "target-packet",
      "output_boundary": "Reference packet template only; do not fill sections or generate packet text.",
      "route_id": "route-002-target-packet"
    },
    {
      "copied_fields": {
        "artifact_class": "protocol",
        "artifact_id": "multiple-myeloma-tooling-readiness-gate-v0",
        "claim_level": "open-question",
        "limitations": [
          "Gate is not builder code.",
          "Gate does not authorize generated claims."
        ],
        "metadata_path": "disease-programs/multiple-myeloma/tooling-readiness-gate-v0.metadata.json",
        "path": "disease-programs/multiple-myeloma/tooling-readiness-gate-v0.md",
        "required_sections": [
          "Validated Input Shapes",
          "Candidate Tooling Gate",
          "Builder Code Gate"
        ],
        "review_status": "source-checked"
      },
      "decision": "copy",
      "manifest_section": "artifact-input-1",
      "output_boundary": "Copied artifact reference only; do not summarize, rewrite, strengthen, rank, or clinically interpret artifact content.",
      "route_id": "route-003-artifact-input-1"
    },
    {
      "copied_fields": {
        "artifact_class": "protocol",
        "artifact_id": "multiple-myeloma-review-packet-builder-manifest-spec-v0",
        "claim_level": "open-question",
        "limitations": [
          "Spec is not builder code.",
          "Spec does not validate real manifest records by itself."
        ],
        "metadata_path": "disease-programs/multiple-myeloma/reviews/review-packet-builder-manifest-spec-v0.metadata.json",
        "path": "disease-programs/multiple-myeloma/reviews/review-packet-builder-manifest-spec-v0.md",
        "required_sections": [
          "Manifest Sections",
          "Forbidden Manifest Fields",
          "Validation Expectations"
        ],
        "review_status": "source-checked"
      },
      "decision": "copy",
      "manifest_section": "artifact-input-2",
      "output_boundary": "Copied artifact reference only; do not summarize, rewrite, strengthen, rank, or clinically interpret artifact content.",
      "route_id": "route-004-artifact-input-2"
    },
    {
      "copied_fields": {
        "artifact_class": "map",
        "artifact_id": "multiple-myeloma-open-research-map-v0-1",
        "claim_level": "open-question",
        "limitations": [
          "Map is not comprehensive.",
          "Map is not clinical guidance."
        ],
        "metadata_path": "disease-programs/multiple-myeloma/open-research-map-v0-1.metadata.json",
        "path": "disease-programs/multiple-myeloma/open-research-map-v0-1.md",
        "required_sections": [
          "Map Nodes",
          "Current Contribution Targets",
          "Review And Publication Boundaries"
        ],
        "review_status": "source-checked"
      },
      "decision": "copy",
      "manifest_section": "artifact-input-3",
      "output_boundary": "Copied artifact reference only; do not summarize, rewrite, strengthen, rank, or clinically interpret artifact content.",
      "route_id": "route-005-artifact-input-3"
    },
    {
      "copied_fields": {
        "artifact_class": "dataset",
        "artifact_id": "multiple-myeloma-roadmap-public-task-queue-v0",
        "claim_level": "open-question",
        "limitations": [
          "Task priority is not evidence strength.",
          "Task priority is not clinical priority."
        ],
        "metadata_path": "disease-programs/multiple-myeloma/public-tasks/multiple-myeloma-roadmap-public-task-queue-v0.metadata.json",
        "path": "disease-programs/multiple-myeloma/public-tasks/multiple-myeloma-roadmap-public-task-queue-v0.md",
        "required_sections": [
          "Task Status",
          "Issue Drafts",
          "Review Boundary"
        ],
        "review_status": "source-checked"
      },
      "decision": "copy",
      "manifest_section": "artifact-input-4",
      "output_boundary": "Copied artifact reference only; do not summarize, rewrite, strengthen, rank, or clinically interpret artifact content.",
      "route_id": "route-006-artifact-input-4"
    },
    {
      "copied_fields": {
        "artifact_class": "protocol",
        "artifact_id": "multiple-myeloma-multidisciplinary-review-packet-template-v0",
        "claim_level": "open-question",
        "limitations": [
          "Template does not make artifacts expert-reviewed.",
          "Template must not be filled with real case facts in public."
        ],
        "metadata_path": "disease-programs/multiple-myeloma/reviews/multidisciplinary-review-packet-template-v0.metadata.json",
        "path": "disease-programs/multiple-myeloma/reviews/multidisciplinary-review-packet-template-v0.md",
        "required_sections": [
          "Do Not Fill Publicly",
          "Review Sections",
          "Completion Gate"
        ],
        "review_status": "expert-review-needed"
      },
      "decision": "copy",
      "manifest_section": "artifact-input-5",
      "output_boundary": "Copied artifact reference only; do not summarize, rewrite, strengthen, rank, or clinically interpret artifact content.",
      "route_id": "route-007-artifact-input-5"
    },
    {
      "copied_fields": {
        "schema_id": "review-packet-builder-manifest.schema.json",
        "schema_path": "schemas/review-packet-builder-manifest.schema.json",
        "template_path": "schemas/review-packet-builder-manifest-template-v0.json",
        "validation_scope": "public manifest records with review_packet_builder_manifest_id"
      },
      "decision": "reference",
      "manifest_section": "schema-input-1",
      "output_boundary": "Reference schema inputs only; schema validity is not expert review, evidence strength, or publication readiness.",
      "route_id": "route-008-schema-input-1"
    },
    {
      "copied_fields": {
        "schema_id": "public-task-queue.schema.json",
        "schema_path": "schemas/public-task-queue.schema.json",
        "template_path": null,
        "validation_scope": "public task queue inputs and next task references"
      },
      "decision": "reference",
      "manifest_section": "schema-input-2",
      "output_boundary": "Reference schema inputs only; schema validity is not expert review, evidence strength, or publication readiness.",
      "route_id": "route-009-schema-input-2"
    },
    {
      "copied_fields": {
        "schema_id": "disease-map.schema.json",
        "schema_path": "schemas/disease-map.schema.json",
        "template_path": "schemas/disease-map-template-v0.json",
        "validation_scope": "open research map companion and disease-map links"
      },
      "decision": "reference",
      "manifest_section": "schema-input-3",
      "output_boundary": "Reference schema inputs only; schema validity is not expert review, evidence strength, or publication readiness.",
      "route_id": "route-010-schema-input-3"
    },
    {
      "copied_fields": {
        "schema_id": "open-question-record.schema.json",
        "schema_path": "schemas/open-question-record.schema.json",
        "template_path": "schemas/open-question-record-template-v0.json",
        "validation_scope": "public research-question links and no-actionability boundaries"
      },
      "decision": "reference",
      "manifest_section": "schema-input-4",
      "output_boundary": "Reference schema inputs only; schema validity is not expert review, evidence strength, or publication readiness.",
      "route_id": "route-011-schema-input-4"
    },
    {
      "copied_fields": {
        "source_ids": [
          "pubmed",
          "clinicaltrials_gov_api_v2",
          "nci_pdq_myeloma_hp",
          "hgnc_gene_names",
          "nci_cancer_drug_dictionary"
        ],
        "source_registry_path": "sources/source-registry-v0.md",
        "source_use": "Source IDs are public provenance anchors only; they do not establish clinical actionability, efficacy, safety, eligibility, availability, or patient fit."
      },
      "decision": "reference",
      "manifest_section": "source-inputs",
      "output_boundary": "Reference public source IDs only; source presence does not imply actionability, efficacy, safety, eligibility, availability, or patient fit.",
      "route_id": "route-012-source-inputs"
    },
    {
      "copied_fields": {
        "linked_claim_ids": [
          "bcma-resistance-is-multifactorial-v0",
          "bcma-target-presence-should-be-extracted-v0",
          "low-bcma-density-supports-alternate-target-research-tracking-v0"
        ]
      },
      "decision": "reference",
      "manifest_section": "reference-ids-linked_claim_ids",